{
  "schema": "pramagraph.resolution_calibration_profile.v2",
  "calibration_version": "financial_first_passage_weighted_neighbors_v2",
  "profile_id": "crypto:binance:XRPUSDT:W1:financial_first_passage_weighted_neighbors_v2",
  "instrument_id": "crypto:binance:XRPUSDT",
  "asset_class": "crypto",
  "timeframe": "W1",
  "scope": "INSTRUMENT",
  "engine_version": "prama-protokol-rs/0.3.0@ddb91cad+D_O_v9-financial-adapter-v2+ODCE-v0.1-financial-normalization-v1+K-MEM-K1-tau32",
  "structural_vector_version": "financial_structural_vector_v2",
  "calibration_start_ns": 1704067200000000000,
  "calibration_end_ns": 1770595200000000000,
  "normalization": {
    "names": [
      "prama.delta",
      "prama.xi_occupancy",
      "prama.capacity",
      "prama.margin",
      "prama.trend",
      "prama.accumulated_excess",
      "d_o.movement",
      "d_o.transport_coherence",
      "d_o.recurrence_persistence",
      "d_o.variation_contraction",
      "d_o.transport_deficit",
      "odce.retained_friction_vs_structural_recovery",
      "odce.retained_friction_vs_adaptive_organization_level",
      "k_mem.strictly_prior_z32"
    ],
    "median": [
      0.04881818592200112,
      0.005475261424739589,
      1.0,
      0.8796425405219156,
      0.4999021104087632,
      0.0,
      2.1443464695014356,
      0.4381391155118374,
      0.5833474249816797,
      0.7884262952188585,
      0.12372176897632531,
      0.6616347025394644,
      0.2622497248277838,
      0.2012630845787433
    ],
    "scale": [
      0.029694977036762042,
      0.00353838381631863,
      1.0,
      0.0007476525232561482,
      0.00004756216049084383,
      1.0,
      0.4692555966045844,
      0.16314911655959258,
      0.13412525387222896,
      0.1501617580881469,
      0.12372176897632531,
      0.04566589184436276,
      0.1055728819976286,
      0.08209129709818459
    ],
    "effective_dimension_mask": [
      true,
      true,
      false,
      true,
      true,
      false,
      true,
      true,
      true,
      true,
      true,
      true,
      true,
      true
    ],
    "effective_dimension_count": 12,
    "fitted_sample_count": 93
  },
  "outcome_label": {
    "volatility_lookback_bars": 10,
    "upper_barrier_volatility_multiple": 1.0743076714101405,
    "lower_barrier_volatility_multiple": 1.0743076714101405,
    "maximum_horizon_bars": 7,
    "up_down_symmetric": true,
    "simultaneous_hit_rule": "RANGE",
    "no_hit_rule": "RANGE_AT_MAXIMUM_HORIZON"
  },
  "estimator": {
    "neighbor_count": 9,
    "minimum_support": 7,
    "maximum_distance": 2.405771569578684,
    "distance_power": 1.0
  },
  "publication": {
    "minimum_direction_edge_bp": 6964,
    "minimum_reliability_bp": 1682,
    "parameters_selected_on": "TEMPORAL_VALIDATION",
    "reliability_evaluated_on": "CONSUMED_DEVELOPMENT_AUDIT",
    "test_outcomes_used_for_parameter_selection": false,
    "requires_positive_brier_skill": true,
    "profile_eligible_for_publication": false,
    "preregistered_protocol_sha256": null
  },
  "reliability": {
    "correct": 2,
    "evaluated": 8,
    "reliability_bp": 2500,
    "reliability_lower_bound_bp": 715,
    "confidence_level_bp": 9500,
    "balanced_accuracy_bp": 2500,
    "multiclass_brier_score": 0.5953080475,
    "climatology_brier_score": 0.5238948062965406,
    "brier_skill_score": -0.13631217630937398,
    "by_direction_bp": {
      "DOWN": 3333,
      "UP": 0
    },
    "by_direction_lower_bound_bp": {
      "DOWN": 968,
      "UP": 0
    },
    "by_actual_direction_bp": {
      "DOWN": 5000,
      "UP": 0
    },
    "actual_support": {
      "DOWN": 4,
      "RANGE": 0,
      "UP": 4
    },
    "predicted_support": {
      "DOWN": 6,
      "RANGE": 0,
      "UP": 2
    },
    "confusion_matrix": {
      "DOWN": {
        "DOWN": 2,
        "RANGE": 0,
        "UP": 2
      },
      "RANGE": {
        "DOWN": 0,
        "RANGE": 0,
        "UP": 0
      },
      "UP": {
        "DOWN": 4,
        "RANGE": 0,
        "UP": 0
      }
    },
    "temporal_split_timestamp_ns": 1766361600000000000,
    "untouched_test": false,
    "evidence_status": "DEVELOPMENT_AUDIT_CONSUMED"
  },
  "diagnostics": {
    "train_samples": 93,
    "validation_samples": 10,
    "evaluation_tail_samples": 8,
    "train_label_counts": {
      "DOWN": 39,
      "RANGE": 12,
      "UP": 42
    },
    "validation_label_counts": {
      "DOWN": 6,
      "RANGE": 1,
      "UP": 3
    },
    "test_label_counts": {
      "DOWN": 4,
      "RANGE": 0,
      "UP": 4
    },
    "total_vector_dimensions": 14,
    "effective_vector_dimensions": 12,
    "features": [
      {
        "name": "prama.delta",
        "available_samples": 93,
        "availability_bp": 10000,
        "empirically_variable": true,
        "included_in_distance": true
      },
      {
        "name": "prama.xi_occupancy",
        "available_samples": 93,
        "availability_bp": 10000,
        "empirically_variable": true,
        "included_in_distance": true
      },
      {
        "name": "prama.capacity",
        "available_samples": 93,
        "availability_bp": 10000,
        "empirically_variable": false,
        "included_in_distance": false
      },
      {
        "name": "prama.margin",
        "available_samples": 93,
        "availability_bp": 10000,
        "empirically_variable": true,
        "included_in_distance": true
      },
      {
        "name": "prama.trend",
        "available_samples": 93,
        "availability_bp": 10000,
        "empirically_variable": true,
        "included_in_distance": true
      },
      {
        "name": "prama.accumulated_excess",
        "available_samples": 93,
        "availability_bp": 10000,
        "empirically_variable": false,
        "included_in_distance": false
      },
      {
        "name": "d_o.movement",
        "available_samples": 93,
        "availability_bp": 10000,
        "empirically_variable": true,
        "included_in_distance": true
      },
      {
        "name": "d_o.transport_coherence",
        "available_samples": 84,
        "availability_bp": 9032,
        "empirically_variable": true,
        "included_in_distance": true
      },
      {
        "name": "d_o.recurrence_persistence",
        "available_samples": 93,
        "availability_bp": 10000,
        "empirically_variable": true,
        "included_in_distance": true
      },
      {
        "name": "d_o.variation_contraction",
        "available_samples": 86,
        "availability_bp": 9247,
        "empirically_variable": true,
        "included_in_distance": true
      },
      {
        "name": "d_o.transport_deficit",
        "available_samples": 84,
        "availability_bp": 9032,
        "empirically_variable": true,
        "included_in_distance": true
      },
      {
        "name": "odce.retained_friction_vs_structural_recovery",
        "available_samples": 85,
        "availability_bp": 9140,
        "empirically_variable": true,
        "included_in_distance": true
      },
      {
        "name": "odce.retained_friction_vs_adaptive_organization_level",
        "available_samples": 69,
        "availability_bp": 7419,
        "empirically_variable": true,
        "included_in_distance": true
      },
      {
        "name": "k_mem.strictly_prior_z32",
        "available_samples": 83,
        "availability_bp": 8925,
        "empirically_variable": true,
        "included_in_distance": true
      }
    ],
    "upper_lower_barrier_ratio": 1.0,
    "d_o_transport_status_counts": {
      "COHERENT": 30,
      "DISRUPTED": 50,
      "PROVISIONAL": 4,
      "UNRESOLVED": 9
    },
    "d_o_transport_evaluable_bp": 9032,
    "odce_adaptive_organization_available_bp": 7419,
    "k_mem_strictly_prior_available_bp": 8925
  },
  "samples": [
    {
      "timestamp_ns": 1704067200000000000,
      "vector": [
        -1.3852004250251815,
        -1.5441384340593938,
        0.0,
        1.5409847233604053,
        2.0581401312844925,
        0.0,
        -4.569676920248555,
        0.0,
        -4.349273594198681,
        0.0,
        0.0,
        0.0,
        0.0,
        0.0
      ],
      "availability_mask": [
        true,
        true,
        false,
        true,
        true,
        false,
        true,
        false,
        true,
        false,
        false,
        false,
        false,
        false
      ],
      "direction": "DOWN",
      "first_passage_bars": 1
    },
    {
      "timestamp_ns": 1704672000000000000,
      "vector": [
        2.0442037986811368,
        -1.4925002333822912,
        0.0,
        1.4896587676080253,
        0.13732987308095873,
        0.0,
        -4.569676920248555,
        0.0,
        -4.349273594198681,
        0.0,
        0.0,
        0.0,
        0.0,
        0.0
      ],
      "availability_mask": [
        true,
        true,
        false,
        true,
        true,
        false,
        true,
        false,
        true,
        false,
        false,
        false,
        false,
        false
      ],
      "direction": "UP",
      "first_passage_bars": 1
    },
    {
      "timestamp_ns": 1705276800000000000,
      "vector": [
        0.5617767031101147,
        -1.4632298069025238,
        0.0,
        1.460558989619968,
        0.6920128918017787,
        0.0,
        -3.9440878245105346,
        0.0,
        -4.349273594198681,
        0.0,
        0.0,
        0.0,
        0.0,
        0.0
      ],
      "availability_mask": [
        true,
        true,
        false,
        true,
        true,
        false,
        true,
        false,
        true,
        false,
        false,
        false,
        false,
        false
      ],
      "direction": "DOWN",
      "first_passage_bars": 2
    },
    {
      "timestamp_ns": 1705881600000000000,
      "vector": [
        -0.8283845557156547,
        -1.453056990231866,
        0.0,
        1.4504444062616688,
        1.1858750021254434,
        0.0,
        -3.3277189414347097,
        0.0,